<?xml version="1.0" encoding="UTF-8" standalone="no"?><sudoku xmlns="https://namespace.fh-muenster.de/studium" xmlns:xsi="http://www.w3.org/2001/XMLSchema-instance" xsi:schemaLocation="https://namespace.fh-muenster.de/studium ../sudoku.xsd"><feld><wert>17</wert></feld><feld><wert>3</wert></feld><feld><wert>0</wert></feld><feld><wert>0</wert></feld><feld><wert>0</wert></feld><feld><wert>0</wert></feld><feld><wert>0</wert></feld><feld><wert>0</wert></feld><feld><wert>0</wert></feld><feld><wert>0</wert></feld><feld><wert>0</wert></feld><feld><wert>0</wert></feld><feld><wert>1</wert></feld><feld><wert>9</wert></feld><feld><wert>5</wert></feld><feld><wert>0</wert></feld><feld><wert>0</wert></feld><feld><wert>0</wert></feld><feld><wert>0</wert></feld><feld><wert>0</wert></feld><feld><wert>8</wert></feld><feld><wert>0</wert></feld><feld><wert>0</wert></feld><feld><wert>0</wert></feld><feld><wert>0</wert></feld><feld><wert>6</wert></feld><feld><wert>0</wert></feld><feld><wert>8</wert></feld><feld><wert>0</wert></feld><feld><wert>0</wert></feld><feld><wert>0</wert></feld><feld><wert>6</wert></feld><feld><wert>0</wert></feld><feld><wert>0</wert></feld><feld><wert>0</wert></feld><feld><wert>0</wert></feld><feld><wert>4</wert></feld><feld><wert>0</wert></feld><feld><wert>0</wert></feld><feld><wert>8</wert></feld><feld><wert>0</wert></feld><feld><wert>0</wert></feld><feld><wert>0</wert></feld><feld><wert>0</wert></feld><feld><wert>1</wert></feld><feld><wert>0</wert></feld><feld><wert>0</wert></feld><feld><wert>0</wert></feld><feld><wert>0</wert></feld><feld><wert>2</wert></feld><feld><wert>0</wert></feld><feld><wert>0</wert></feld><feld><wert>0</wert></feld><feld><wert>0</wert></feld><feld><wert>0</wert></feld><feld><wert>6</wert></feld><feld><wert>0</wert></feld><feld><wert>0</wert></feld><feld><wert>0</wert></feld><feld><wert>0</wert></feld><feld><wert>2</wert></feld><feld><wert>8</wert></feld><feld><wert>0</wert></feld><feld><wert>0</wert></feld><feld><wert>0</wert></feld><feld><wert>0</wert></feld><feld><wert>4</wert></feld><feld><wert>1</wert></feld><feld><wert>9</wert></feld><feld><wert>0</wert></feld><feld><wert>0</wert></feld><feld><wert>5</wert></feld><feld><wert>0</wert></feld><feld><wert>0</wert></feld><feld><wert>0</wert></feld><feld><wert>0</wert></feld><feld><wert>0</wert></feld><feld><wert>0</wert></feld><feld><wert>0</wert></feld><feld><wert>7</wert></feld><feld><wert>0</wert></feld></sudoku>